Title,Price,Category,Rating,ReviewCount,Description
"1. MVMT Menís Legacy Slim Watch - Analog Watch for Men - Minimalist, Water Resistant 3 ATM/30 Meters Menís Dress Watch - Premium Japanese Quartz Menís Wristwatch - 42mm",$11.80 ,Watches,4,"3,122","Minimalist, Water Resistant 3 ATM/30 Meters Menís Dress Watch - Premium Japanese Quartz Menís Wristwatch - 42mm"
2. Amazon Essentials Women's Digital Chronograph Resin Strap Watch,$16.90 ,Watches,4.6,"17,887",Amazon Essentials Women's Digital Chronograph Resin Strap Watch
3. Casio Illuminator AE1500WH Series | 10-Year Battery | LED Backlight | 5-Alarms | 1/100 Sec Stopwatch | Men's Digital Watch,$17.97 ,Watches,4.5,"21,569",Casio Illuminator AE1500WH Series | 10-Year Battery | LED Backlight | 5-Alarms | 1/100 Sec Stopwatch | Men's Digital Watch
4. Fossil Nate Men's Watch with Oversized Chronograph Watch Dial and Stainless Steel or Leather Band,$26.95 ,Watches,4.4,"5,436",Fossil Nate Men's Watch with Oversized Chronograph Watch Dial and Stainless Steel or Leather Band
5. Amazon Essentials Men's Easy to Read Strap Watch,$104.10 ,Watches,4.4,"26,350",Amazon Essentials Men's Easy to Read Strap Watch
6. Timex Men's Expedition Scout 40mm Watch,$180.00 ,Watches,4.6,"6,497",Timex Men's Expedition Scout 40mm Watch
7. Invicta Men's Pro Diver Quartz Watch with Stainless Steel Strap,$18.06 ,Watches,4.4,"16,043",Invicta Men's Pro Diver Quartz Watch with Stainless Steel Strap
8. Timex Men's Easy Reader Watch,$45.50 ,Watches,4.6,"18,541",Timex Men's Easy Reader Watch
9. Fossil Grant Men's Watch with Chronograph or Automatic Display and Genuine Leather or Stainless Steel Band,$65.00 ,Watches,4.5,"6,527",Fossil Grant Men's Watch with Chronograph or Automatic Display and Genuine Leather or Stainless Steel Band
"10. Samsung Galaxy Watch 6 44mm Bluetooth Smartwatch, Fitness Tracker, Personalized HR Zones, Advanced Sleep Coaching, Heart Monitor, BIA Sensor, Health Wellness Insights, Big Screen, US Version, Graphite",$38.98 ,Watches,4.4,"2,141","Samsung Galaxy Watch 6 44mm Bluetooth Smartwatch, Fitness Tracker, Personalized HR Zones, Advanced Sleep Coaching, Heart Monitor, BIA Sensor, Health Wellness Insights, Big Screen, US Version, Graphite"
11. Nine West Women's Strap Watch,$53.09 ,Watches,4.7,"27,726",Nine West Women's Strap Watch
12. Casio AE1200WH Series | Men‚Äôs Digital Watch | 100M WR | Multi Alarms | 100 SEC Stopwatch | Countdown Timer | World Map for World Time | LED Light | LC Analog Display | 10 Year Battery,$90.76 ,Watches,4.5,"19,744",Casio AE1200WH Series | Men‚Äôs Digital Watch | 100M WR | Multi Alarms | 100 SEC Stopwatch | Countdown Timer | World Map for World Time | LED Light | LC Analog Display | 10 Year Battery
13. Timex Men's Easy Reader Watch,$160.00 ,Watches,4.5,"9,622",Timex Men's Easy Reader Watch
"14. Fossil Minimalist Men's Watch with Leather or Stainless Steel Band, Chronograph or Analog Watch Display with Slim Case Design",$169.99 ,Watches,4.5,"10,881","Fossil Minimalist Men's Watch with Leather or Stainless Steel Band, Chronograph or Analog Watch Display with Slim Case Design"
15. Nine West Women's Crystal Accented Bracelet Watch,$329.99 ,Watches,4.4,561,Nine West Women's Crystal Accented Bracelet Watch
16. Anne Klein Women's Glitter Accented Bracelet Watch,$16.84 ,Watches,4.5,"22,358",Anne Klein Women's Glitter Accented Bracelet Watch
17. Timex Unisex Weekender 38mm Watch,$36.75 ,Watches,4.2,"1,051",Timex Unisex Weekender 38mm Watch
18. Amazon Essentials Women's Faux Leather Strap Watch,$130.00 ,Watches,4.4,"4,709",Amazon Essentials Women's Faux Leather Strap Watch
"19. Fitbit Versa 2 Special Edition Health and Fitness Smartwatch with Heart Rate, Music, Alexa Built-In, Sleep and Swim Tracking, Smoke Woven/Mist Grey, One Size (S and L Bands Included)",$18.63 ,Watches,4.5,385,"Fitbit Versa 2 Special Edition Health and Fitness Smartwatch with Heart Rate, Music, Alexa Built-In, Sleep and Swim Tracking, Smoke Woven/Mist Grey, One Size (S and L Bands Included)"
"20. Nurse Watch for Nurses Doctors Women Men,Waterproof Analog Watches with Luminous Dial and Japanese Quartz Movement,Easy to Read Military Time Watch with Second Hand, 12/24 Hours,Silicone Band",$36.75 ,Watches,4.7,19,"Nurse Watch for Nurses Doctors Women Men,Waterproof Analog Watches with Luminous Dial and Japanese Quartz Movement,Easy to Read Military Time Watch with Second Hand, 12/24 Hours,Silicone Band"
21. Mens Sports Wrist Watches Analog Digital Tactical Military Watch Waterproof Gold Watches for Men,$29.99 ,Watches,4.5,"12,677",Mens Sports Wrist Watches Analog Digital Tactical Military Watch Waterproof Gold Watches for Men
"22. GOLDEN HOUR Fashion Business Mens Watches with Stainless Steel Waterproof Chronograph Quartz Watch for Men, Auto Date",$32.38 ,Watches,4.7,"53,452","GOLDEN HOUR Fashion Business Mens Watches with Stainless Steel Waterproof Chronograph Quartz Watch for Men, Auto Date"
"23. Casio MDV106 Series | Unisex Analog Watch | 200M WR | Stainless Steel Case | Resin Band | 2 Hand Analog (HR, Min, SEC) | Date Display | Screw Down Crown/Screw Down Caseback | 3 Year Battery",$29.76 ,Watches,4.6,"5,753","Casio MDV106 Series | Unisex Analog Watch | 200M WR | Stainless Steel Case | Resin Band | 2 Hand Analog (HR, Min, SEC) | Date Display | Screw Down Crown/Screw Down Caseback | 3 Year Battery"
24. Fossil Neutra Men's Chronograph Watch with Stainless Steel Bracelet or Genuine Leather Band,$39.90 ,Watches,4.3,261,Fossil Neutra Men's Chronograph Watch with Stainless Steel Bracelet or Genuine Leather Band
"25. LIGE Smart Watches for Men (Military Tactical Style), Make/Answer Call, 1.39'' Fitness Tracker with 100+ Sports Modes, Health Monitor Smart Watch for Android iOS, 3 Style Watch Strap Black Brown",$13.90 ,Watches,4.3,241,"LIGE Smart Watches for Men (Military Tactical Style), Make/Answer Call, 1.39'' Fitness Tracker with 100+ Sports Modes, Health Monitor Smart Watch for Android iOS, 3 Style Watch Strap Black Brown"
26. MVMT Chrono Men's Watch - Japanese Quartz Chronograph - Water Resistant 3 to 5 ATM/30 to 50 Meters,$19.90 ,Watches,4.5,"19,744",MVMT Chrono Men's Watch - Japanese Quartz Chronograph - Water Resistant 3 to 5 ATM/30 to 50 Meters
27. Timex Men's Easy Reader Watch,$149.95 ,Watches,4.1,"1,401",Timex Men's Easy Reader Watch
"28. LIGE Smart Watches for Men, 1.39"" Military Smartwatch with SpO2, Sleep Monitor, Step Counter, 24/7 Heart Rate, Tactical Fitness Watch with 100+ Sports Modes, Make/Answer Call, Metal Band, Black",$19.19 ,Watches,4.3,"4,331","LIGE Smart Watches for Men, 1.39"" Military Smartwatch with SpO2, Sleep Monitor, Step Counter, 24/7 Heart Rate, Tactical Fitness Watch with 100+ Sports Modes, Make/Answer Call, Metal Band, Black"
29. Timex Women's Easy Reader Watch,$23.99 ,Watches,4.5,"11,528",Timex Women's Easy Reader Watch
"30. Casio FT500WC Series | Men's Analog Watch | 100 Meter Water Resistance | LED Light | Date Display | Leather/Cloth Band | Regular Time Keeping (HR, Min, SEC, PM, Date, Day) | 3 Year Battery",$19.97 ,Watches,5,28,"Casio FT500WC Series | Men's Analog Watch | 100 Meter Water Resistance | LED Light | Date Display | Leather/Cloth Band | Regular Time Keeping (HR, Min, SEC, PM, Date, Day) | 3 Year Battery"
1. Check each product page for other buying options. Price and other details may vary based on product size and color.,$15.59 ,Cat Supplies,4.3,"5,926",Check each product page for other buying options. Price and other details may vary based on product size and color.
"2. Cat Window Perch, Cat Hammock Window Seat w/Free Fleece Blanket 2024 Latest Screw Suction Cups Extra Large Sturdy Cat Bed Cat Resting Seat Hold Two Large Cats White Indoors (One Extra Suction Cup",$19.49 ,Cat Supplies,4.2,454,"Cat Window Perch, Cat Hammock Window Seat w/Free Fleece Blanket 2024 Latest Screw Suction Cups Extra Large Sturdy Cat Bed Cat Resting Seat Hold Two Large Cats White Indoors (One Extra Suction Cup"
3. Spray Cat Brush for Shedding - Water Brush for Cats and Dogs - Pet Hair Removal Comb - Steamy Cat Brush - Sky Blue,$9.99 ,Cat Supplies,4.3,"7,797",Spray Cat Brush for Shedding - Water Brush for Cats and Dogs - Pet Hair Removal Comb - Steamy Cat Brush - Sky Blue
4. Cat Water Fountain Stainless Steel: 3.2L/108oz Pet Fountain Water Bowl Dog Drinking Dispenser Cat Feeding & Watering Supplies Animal Metal Kitty Spout for Cats Inside with 4 Replacement Filters,$9.99 ,Cat Supplies,3.4,17,Cat Water Fountain Stainless Steel: 3.2L/108oz Pet Fountain Water Bowl Dog Drinking Dispenser Cat Feeding & Watering Supplies Animal Metal Kitty Spout for Cats Inside with 4 Replacement Filters
"5. Cat Steam Brush, 3 in 1 Self Cleaning Steamy Cat Brush, Spray Silicone Massage Comb, Cat Brush for Shedding, Pet Hair Removal Tool with Handle Multifunctional Grooming Brush for Dogs Cats",$15.12 ,Cat Supplies,4.3,"82,501","Cat Steam Brush, 3 in 1 Self Cleaning Steamy Cat Brush, Spray Silicone Massage Comb, Cat Brush for Shedding, Pet Hair Removal Tool with Handle Multifunctional Grooming Brush for Dogs Cats"
6. Dr. Elsey's Cat Litter - Premium Unscented Cat Litter w/ Natural Ingredients - Low Dust Superior Odor Control Cat Litter - Hard Clumping Moisture Absorbing Clay Multi Cat Litter (For All Cats - 40lbs),$34.99 ,Cat Supplies,4.3,"4,892",Dr. Elsey's Cat Litter - Premium Unscented Cat Litter w/ Natural Ingredients - Low Dust Superior Odor Control Cat Litter - Hard Clumping Moisture Absorbing Clay Multi Cat Litter (For All Cats - 40lbs)
"7. Veken Innovation Award Winner Stainless Steel Cat Water Fountain, 95oz/2.8L Automatic Pet Fountain Dog Water Dispenser with Replacement Filters & Silicone Mat for Cats, Dogs, Multiple Pets (Silver)",$39.99 ,Cat Supplies,4.4,"4,935","Veken Innovation Award Winner Stainless Steel Cat Water Fountain, 95oz/2.8L Automatic Pet Fountain Dog Water Dispenser with Replacement Filters & Silicone Mat for Cats, Dogs, Multiple Pets (Silver)"
"8. Laser Cat Toys for Indoor Cats,The 4th Generation Real Random Trajectory Motion Activated Rechargeable Automatic Cat Laser Toy,Interactive Cat Toys for Bored Indoor Adult Cats/Kittens/Dogs",$10.99 ,Cat Supplies,4.5,"7,488","Laser Cat Toys for Indoor Cats,The 4th Generation Real Random Trajectory Motion Activated Rechargeable Automatic Cat Laser Toy,Interactive Cat Toys for Bored Indoor Adult Cats/Kittens/Dogs"
9. Self Warming Cat Bed Self Heating Cat Dog Mat 24 x 18 inch Extra Warm Thermal Pet Pad for Indoor Outdoor Pets with Removable Cover Non-Slip Bottom Washable,$10.99 ,Cat Supplies,4.5,"73,037",Self Warming Cat Bed Self Heating Cat Dog Mat 24 x 18 inch Extra Warm Thermal Pet Pad for Indoor Outdoor Pets with Removable Cover Non-Slip Bottom Washable
10. Advantage II Large Cat Vet-Recommended Flea Treatment & Prevention | Cats Over 9 lbs. | 6-Month Supply,$20.99 ,Cat Supplies,4.3,"6,196",Advantage II Large Cat Vet-Recommended Flea Treatment & Prevention | Cats Over 9 lbs. | 6-Month Supply
"11. MILIFUN Cat Food Bowls Elevated Tilted, Anti Vomiting Orthopedic Kitty Bowls for Puppy and Bunny, Indoor Cats.",$0.03 ,Cat Supplies,4.2,51,"MILIFUN Cat Food Bowls Elevated Tilted, Anti Vomiting Orthopedic Kitty Bowls for Puppy and Bunny, Indoor Cats."
"12. Smart Automatic Cat Feeders, Dual Power Supply Cat Food Distributor, WiFi Pet Feeder with APP Control for Remote Feeding, Moisture-Proof Freshness Design, 3L Automatic Cat Feeder (Grey)",$23.99 ,Cat Supplies,4.2,62,"Smart Automatic Cat Feeders, Dual Power Supply Cat Food Distributor, WiFi Pet Feeder with APP Control for Remote Feeding, Moisture-Proof Freshness Design, 3L Automatic Cat Feeder (Grey)"
"13. Wireless Cat Water Fountain Stainless Steel, 108oz/3.5L Cat Fountain Battery Operated, Cordless Pet Water Fountain for Cats Dogs with Motion Sensor, Ultra Quiet Pump, Multi-Filtration",$29.99 ,Cat Supplies,4.3,94,"Wireless Cat Water Fountain Stainless Steel, 108oz/3.5L Cat Fountain Battery Operated, Cordless Pet Water Fountain for Cats Dogs with Motion Sensor, Ultra Quiet Pump, Multi-Filtration"
"14. Cat Water Fountain Stainless Steel: 108oz/3.2L Cat Fountain for Drinking, Pet Fountain Water Bowl Dog Drinking Dispenser Cat Feeding & Watering Supplies, Super Quiet Kitty Spout for Cats Dogs",$35.99 ,Cat Supplies,4.5,78,"Cat Water Fountain Stainless Steel: 108oz/3.2L Cat Fountain for Drinking, Pet Fountain Water Bowl Dog Drinking Dispenser Cat Feeding & Watering Supplies, Super Quiet Kitty Spout for Cats Dogs"
"15. Elevated Cat Bowls Whisker Friendly,Cat Food Bowls with Silicone Food Mat,15¬∞Tilted Stand Anti Vomiting Raised Cat Dishes for Food and Water,2 Stainless Steel Bowls for Cats and Puppy",$25.00 ,Cat Supplies,4.6,"2,068","Elevated Cat Bowls Whisker Friendly,Cat Food Bowls with Silicone Food Mat,15¬∞Tilted Stand Anti Vomiting Raised Cat Dishes for Food and Water,2 Stainless Steel Bowls for Cats and Puppy"
"16. Potaroma Cat Toys Saury Fish, 3 Pack Catnip Crinkle Sound Toys Soft and Durable, Interactive Cat Kicker Toys for Indoor Kitten Exercise 9.4 Inches for All Breeds",$25.00 ,Cat Supplies,4.1,"9,813","Potaroma Cat Toys Saury Fish, 3 Pack Catnip Crinkle Sound Toys Soft and Durable, Interactive Cat Kicker Toys for Indoor Kitten Exercise 9.4 Inches for All Breeds"
"17. PetSafe ScoopFree Crystal Pro Self Cleaning Litter Box, Automatic Cat Litter Box - Comes with 1 Disposable Crystal Litter Tray (Grey, Uncovered)",$22.99 ,Cat Supplies,4.3,"58,004","PetSafe ScoopFree Crystal Pro Self Cleaning Litter Box, Automatic Cat Litter Box - Comes with 1 Disposable Crystal Litter Tray (Grey, Uncovered)"
"18. rabbitgoo Cat Harness and Leash for Walking, Escape Proof Soft Adjustable Vest Harnesses for Cats, Easy Control Breathable Reflective Strips Jacket, Black, XXS",$22.99 ,Cat Supplies,4.6,"13,372","rabbitgoo Cat Harness and Leash for Walking, Escape Proof Soft Adjustable Vest Harnesses for Cats, Easy Control Breathable Reflective Strips Jacket, Black, XXS"
"19. Andiker Cat Spiral Spring, 12 Pc Cat Creative Toy to Kill Time and Keep Fit Interactive Cat Toy Sturdy Heavy Plastic Spring Colorful Springs Cat Toy for Swatting, Biting, Hunting Kitten Toys",$26.99 ,Cat Supplies,4.6,25,"Andiker Cat Spiral Spring, 12 Pc Cat Creative Toy to Kill Time and Keep Fit Interactive Cat Toy Sturdy Heavy Plastic Spring Colorful Springs Cat Toy for Swatting, Biting, Hunting Kitten Toys"
"20. Kastty Quiet Cat Water Fountain, 3.5L/118oz Large Capacity Pet Water Fountain for Cats Indoor with Water Level and LED Light, Easy Cleaning Cat Fountains for Drinking Automatic Dog Water Fountain",$10.99 ,Cat Supplies,4.8,808,"Kastty Quiet Cat Water Fountain, 3.5L/118oz Large Capacity Pet Water Fountain for Cats Indoor with Water Level and LED Light, Easy Cleaning Cat Fountains for Drinking Automatic Dog Water Fountain"
"21. YCT Cat Food Mat for Pet Dog Food Mat, Cat Mat for Food and Water, Cat Feeding Mat Pet Dog Cat Bowl Mat, Non-Slip Super Absorbent, with Multiple cat Heads LogoÔºå18.1 x 11.8 inches, Dark Grey",$36.99 ,Cat Supplies,5,3,"YCT Cat Food Mat for Pet Dog Food Mat, Cat Mat for Food and Water, Cat Feeding Mat Pet Dog Cat Bowl Mat, Non-Slip Super Absorbent, with Multiple cat Heads LogoÔºå18.1 x 11.8 inches, Dark Grey"
"22. 2K Pet Collar Camera with 32GB SD Card,Cat Collar Camera with Phone app,20MP WiFi Dog Collar Camera,Pet Camera Accessories Newly Upgraded,Lightweight Action Camera with Remote",$36.99 ,Cat Supplies,3.6,630,"2K Pet Collar Camera with 32GB SD Card,Cat Collar Camera with Phone app,20MP WiFi Dog Collar Camera,Pet Camera Accessories Newly Upgraded,Lightweight Action Camera with Remote"
"23. Cat Litter Scooper with Holder, Cat Litter Shovel with Waste Can and Refill 135 Bags(9 Boxes of 15 Bags), Large Capacity Cat Scooper Portable Shovel",$52.85 ,Cat Supplies,4.4,"12,497","Cat Litter Scooper with Holder, Cat Litter Shovel with Waste Can and Refill 135 Bags(9 Boxes of 15 Bags), Large Capacity Cat Scooper Portable Shovel"
"24. Burt's Bees for Pets Cat Naturally Derived Waterless Shampoo with Shea Butter and Honey - Cat Waterless Shampoo Spray - Easy to Use Cat Dry Shampoo - Made in the USA, 10 Oz",$52.85 ,Cat Supplies,4.5,"8,474","Burt's Bees for Pets Cat Naturally Derived Waterless Shampoo with Shea Butter and Honey - Cat Waterless Shampoo Spray - Easy to Use Cat Dry Shampoo - Made in the USA, 10 Oz"
"25. Poils bebe L Shape Cat Scratcher, 26.8 Inch Cat Scratchers for Indoor Cats, Protecting Furniture Cat Scratch Pad, Cardboard Cat Scratching with Ball Toy, Catnip, Large",$69.85 ,Cat Supplies,4.4,"24,478","Poils bebe L Shape Cat Scratcher, 26.8 Inch Cat Scratchers for Indoor Cats, Protecting Furniture Cat Scratch Pad, Cardboard Cat Scratching with Ball Toy, Catnip, Large"
26. Coching Cat Scratcher Cardboard Cat Scratch Pad with Premium Scratch Textures Design Durable Cat Scratching Pad Reversible,$32.95 ,Cat Supplies,4.5,"62,337",Coching Cat Scratcher Cardboard Cat Scratch Pad with Premium Scratch Textures Design Durable Cat Scratching Pad Reversible
"27. Catstages Tower of Tracks Interactive 3-Tier Cat Track Toy with Spinning Balls, Orange",$32.95 ,Cat Supplies,4.1,"1,276","Catstages Tower of Tracks Interactive 3-Tier Cat Track Toy with Spinning Balls, Orange"
"28. PETLIBRO Cat Water Fountain, Wireless Pet Fountain Battery Operated, 2.5L/84oz Dockstream Automatic Dog Water Dispenser for Drinking with Quiet Pump Inside Stainless Steel Tray Easy Clean BPA-Free",$35.99 ,Cat Supplies,4.5,816,"PETLIBRO Cat Water Fountain, Wireless Pet Fountain Battery Operated, 2.5L/84oz Dockstream Automatic Dog Water Dispenser for Drinking with Quiet Pump Inside Stainless Steel Tray Easy Clean BPA-Free"
29. Comotech 3PCS Cat Grooming Kit | Cat Brush | Cat Brushes for indoor Cats | Cat Nail Clipper | Cat Nail Trimmer | Cat Bath Brush | Cat Brush for Shedding - Premium Cat Supplies (Green),$19.99 ,Cat Supplies,4.5,"6,584",Comotech 3PCS Cat Grooming Kit | Cat Brush | Cat Brushes for indoor Cats | Cat Nail Clipper | Cat Nail Trimmer | Cat Bath Brush | Cat Brush for Shedding - Premium Cat Supplies (Green)
"30. PETLIBRO Automatic Cat Feeder, Automatic Cat Food Dispenser with Freshness Preservation, Timed Cat Feeders for Dry Food, Up to 50 Portions 6 Meals Per Day, Granary Pet Feeder for Cats",$12.98 ,Cat Supplies,4.4,"51,765","PETLIBRO Automatic Cat Feeder, Automatic Cat Food Dispenser with Freshness Preservation, Timed Cat Feeders for Dry Food, Up to 50 Portions 6 Meals Per Day, Granary Pet Feeder for Cats"
1. Check each product page for other buying options. Price and other details may vary based on product size and color.,$379.00 ,Furniture,4.2,383,Check each product page for other buying options. Price and other details may vary based on product size and color.
"2. Branch Ergonomic Chair - A Versatile Desk Chair with Adjustable Lumbar Support, Breathable Mesh Backrest, and Smooth Wheels - Experience Optimal Comfort and Support - Pebble - White",$45.99 ,Furniture,4.5,"2,191","Branch Ergonomic Chair - A Versatile Desk Chair with Adjustable Lumbar Support, Breathable Mesh Backrest, and Smooth Wheels - Experience Optimal Comfort and Support - Pebble - White"
"3. Yoobure Tree Bookshelf - 6 Shelf Retro Floor Standing Bookcase, Tall Wood Book Storage Rack for CDs/Movies/Books, Utility Book Organizer Shelves for Bedroom, Living Room, Home Office",$65.99 ,Furniture,4.5,"3,521","Yoobure Tree Bookshelf - 6 Shelf Retro Floor Standing Bookcase, Tall Wood Book Storage Rack for CDs/Movies/Books, Utility Book Organizer Shelves for Bedroom, Living Room, Home Office"
"4. SUPERJARE Nightstand with Charging Station, Bed Side Table with Adjustable Fabric Drawer, Night Stand for Bedroom, 3-Tier Storage End Table, for Living Room, Rustic Brown and Black",$99.99 ,Furniture,4.4,"6,301","SUPERJARE Nightstand with Charging Station, Bed Side Table with Adjustable Fabric Drawer, Night Stand for Bedroom, 3-Tier Storage End Table, for Living Room, Rustic Brown and Black"
"5. WLIVE Dresser for Bedroom with 8 Drawers, Wide Fabric Dresser for Storage and Organization, Bedroom Dresser, Chest of Drawers for Living Room, Closet, Hallway, Charcoal Black Wood Grain Print",$149.99 ,Furniture,4.1,87,"WLIVE Dresser for Bedroom with 8 Drawers, Wide Fabric Dresser for Storage and Organization, Bedroom Dresser, Chest of Drawers for Living Room, Closet, Hallway, Charcoal Black Wood Grain Print"
"6. MAXYOYO Folding Sofa Bed, Convertible Sleeper Chair with Pillow Foldable Mattress with Back Support, Portable Fold Out Chair Bed Comfy Floor Sofa Lounge for Living Room Bedroom, Green, Single",$37.99 ,Furniture,4.2,812,"MAXYOYO Folding Sofa Bed, Convertible Sleeper Chair with Pillow Foldable Mattress with Back Support, Portable Fold Out Chair Bed Comfy Floor Sofa Lounge for Living Room Bedroom, Green, Single"
"7. Lerliuo Rattan Nightstand, Boho Side Table with Drawer Open Shelf, Cane Accent Bedside End Table with Solid Wood Legs for Bedroom, Dorm and Small Spaces (Natural)",$89.99 ,Furniture,4.6,"2,194","Lerliuo Rattan Nightstand, Boho Side Table with Drawer Open Shelf, Cane Accent Bedside End Table with Solid Wood Legs for Bedroom, Dorm and Small Spaces (Natural)"
"8. Industrial Table Lamps for Bedrooms Set of 2 - Fully Dimmable Bedside Lamps with USB A and C Ports and Outlet, Black Nightstand Lamps with Glass Shade for Living Room, Desk Lamps for Office Reading",$39.98 ,Furniture,4,277,"Industrial Table Lamps for Bedrooms Set of 2 - Fully Dimmable Bedside Lamps with USB A and C Ports and Outlet, Black Nightstand Lamps with Glass Shade for Living Room, Desk Lamps for Office Reading"
"9. Night Stand Set 2, End Table with Charging Station, LED Bedside Table with Fabric Drawer for Bedroom, 3-Tier Side Table with Open Shelf, Black",$19.99 ,Furniture,4.4,"17,852","Night Stand Set 2, End Table with Charging Station, LED Bedside Table with Fabric Drawer for Bedroom, 3-Tier Side Table with Open Shelf, Black"
"10. WLIVE Night Stand, Small 2 Drawer Dresser, Nightstand with Fabric Bins for Bedroom, Closet, Dorm, Rustic Brown Wood Grain Print, 11.8"" D x 15.7"" W x 20.9"" H",$49.99 ,Furniture,4.1,370,"WLIVE Night Stand, Small 2 Drawer Dresser, Nightstand with Fabric Bins for Bedroom, Closet, Dorm, Rustic Brown Wood Grain Print, 11.8"" D x 15.7"" W x 20.9"" H"
"11. NeuType Arched Full Length Mirror Standing Hanging or Leaning Against Wall, Oversized Large Bedroom Mirror Floor Mirror Dressing Mirror, Aluminum Alloy Thin Frame, Gold, 65""x22""",$75.99 ,Furniture,4.6,"24,621","NeuType Arched Full Length Mirror Standing Hanging or Leaning Against Wall, Oversized Large Bedroom Mirror Floor Mirror Dressing Mirror, Aluminum Alloy Thin Frame, Gold, 65""x22"""
"12. SONGMICS 30 Inches Folding Storage Ottoman Bench, Storage Chest, Foot Rest Stool, Light Gray ULSF47G",$25.45 ,Furniture,4.5,"3,340","SONGMICS 30 Inches Folding Storage Ottoman Bench, Storage Chest, Foot Rest Stool, Light Gray ULSF47G"
"13. Pipishell Coat Rack Sturdy Wooden Coat Rack Stand, Adjustable Coat Tree, Free Standing Tree Hanger with 4 Sections & 8 Hooks, for Home/Bedroom/Office/Hallway/Entryway",$42.88 ,Furniture,4.2,"3,166","Pipishell Coat Rack Sturdy Wooden Coat Rack Stand, Adjustable Coat Tree, Free Standing Tree Hanger with 4 Sections & 8 Hooks, for Home/Bedroom/Office/Hallway/Entryway"
"14. SPACELEAD Slim Storage Cart 4 Tier, Storage Organizer Rolling Utility/Mobile Shelving Unit Slide Out Storage Cart for Office, Bathroom, Kitchen, Laundry Room & Narrow PlacesÔºå Green",$138.50 ,Furniture,3.7,11,"SPACELEAD Slim Storage Cart 4 Tier, Storage Organizer Rolling Utility/Mobile Shelving Unit Slide Out Storage Cart for Office, Bathroom, Kitchen, Laundry Room & Narrow PlacesÔºå Green"
"15. Tall Nightstand with Light and Charging Station, Night Stand with 3 Fabric Drawers and Storage Shelf, Nightstands Bedside Tables with USB Ports Outlets for Bedroom, Home, Dorm (White)",$42.99 ,Furniture,4.3,"3,452","Tall Nightstand with Light and Charging Station, Night Stand with 3 Fabric Drawers and Storage Shelf, Nightstands Bedside Tables with USB Ports Outlets for Bedroom, Home, Dorm (White)"
"16. WLIVE TV Stand for 55 60 inch TV, Mid Century Modern TV Console, Entertainment Center with Storage for Living Room, Retro Brown",$29.99 ,Furniture,4.1,149,"WLIVE TV Stand for 55 60 inch TV, Mid Century Modern TV Console, Entertainment Center with Storage for Living Room, Retro Brown"
"17. Furnulem Tall Nightstand with Charging Station, Night Stands with LED Lights and Storage Shelves, Bed Side Table for Bedroom, Hallway, Office, 4 Fabric Drawers, Rustic Brown",$26.99 ,Furniture,4.4,"2,842","Furnulem Tall Nightstand with Charging Station, Night Stands with LED Lights and Storage Shelves, Bed Side Table for Bedroom, Hallway, Office, 4 Fabric Drawers, Rustic Brown"
18. VTRIN Vertical Narrow Shoe Rack Organizer Tall Shoe Rack for Closet Entryway 10 Tier Non-Woven Cover Shoe Shelf Holds 20-22 Pairs Free Standing Shoe Storage Cabinet with Dustproof Cover Black,$59.49 ,Furniture,4.5,"33,273",VTRIN Vertical Narrow Shoe Rack Organizer Tall Shoe Rack for Closet Entryway 10 Tier Non-Woven Cover Shoe Shelf Holds 20-22 Pairs Free Standing Shoe Storage Cabinet with Dustproof Cover Black
"19. Adhesive Shower Caddy, 5 Pack Rustproof Stainless Steel Bath Organizers With Large Capacity, No Drilling Shelves for Bathroom Storage & Home Decor",$69.99 ,Furniture,4.2,247,"Adhesive Shower Caddy, 5 Pack Rustproof Stainless Steel Bath Organizers With Large Capacity, No Drilling Shelves for Bathroom Storage & Home Decor"
"20. Genina Recliner Cover Stretch Couch Covers, Sofa slipcover for Reclining Couch Thick Jacquard Furniture Protector Washable (Taupe, 1 Seat)",$114.99 ,Furniture,4.5,20,"Genina Recliner Cover Stretch Couch Covers, Sofa slipcover for Reclining Couch Thick Jacquard Furniture Protector Washable (Taupe, 1 Seat)"
