Title,Price,Category,Rating,ReviewCount,Description
"21. Office Chair, Ergonomic Desk Chair with Adjustable Lumbar Support, High Back Mesh Computer Chair with Heavy Duty Metal Base, Executive Chair for Home Office",$53.99 ,Furniture,4.6,86,"Office Chair, Ergonomic Desk Chair with Adjustable Lumbar Support, High Back Mesh Computer Chair with Heavy Duty Metal Base, Executive Chair for Home Office"
"22. HAOMAIJIA Non Slip Couch Cover Sofa Covers for 3 Cushion Couch Washable sectional Couch Covers for Dogs pet Furniture Protector Couch Cover Blanket for Living Room (Brown, 91""x134"")",$69.99 ,Furniture,4.6,69,"HAOMAIJIA Non Slip Couch Cover Sofa Covers for 3 Cushion Couch Washable sectional Couch Covers for Dogs pet Furniture Protector Couch Cover Blanket for Living Room (Brown, 91""x134"")"
"23. TEMI Small Computer Desk Folding Table - 35.8"" Foldable Office Desk, No Assembly, Perfect for Small Spaces in Bedroom, Dorm, or Apartment, Portable Mini Desk or Study Table with Compact Design, Brown",$29.99 ,Furniture,4.2,31,"TEMI Small Computer Desk Folding Table - 35.8"" Foldable Office Desk, No Assembly, Perfect for Small Spaces in Bedroom, Dorm, or Apartment, Portable Mini Desk or Study Table with Compact Design, Brown"
"24. Night Stand Set 2,Nightstand with Charging Station,Induction Light and LED Light,Bedside Table with Drawers,Modern Nightstand End Side Table for Bedroom,Nightstands with Bookshelf,Black",$16.13 ,Furniture,4.4,"1,597","Night Stand Set 2,Nightstand with Charging Station,Induction Light and LED Light,Bedside Table with Drawers,Modern Nightstand End Side Table for Bedroom,Nightstands with Bookshelf,Black"
"25. DWVO Dresser with 9 Drawers - Fabric Storage Tower, Organizer Unit for Living Room, Hallway - Sturdy Steel Frame, Wooden Top & Easy Pull Fabric Bins",$18.98 ,Furniture,4.6,"1,626","DWVO Dresser with 9 Drawers - Fabric Storage Tower, Organizer Unit for Living Room, Hallway - Sturdy Steel Frame, Wooden Top & Easy Pull Fabric Bins"
"26. VASAGLE End Table, Small Bedside Table with Fabric Basket, Modern Nightstand, Round Side Table, for Living Room, Bedroom, Cream White ULET223K67",$25.99 ,Furniture,4.3,"14,407","VASAGLE End Table, Small Bedside Table with Fabric Basket, Modern Nightstand, Round Side Table, for Living Room, Bedroom, Cream White ULET223K67"
"27. BAYKA Floating Shelves for Wall, Wall Mounted Rustic Wood Shelves for Bathroom, Bedroom, Living Room, Kitchen, Hanging Shelf for Books/Storage/Room Decor with 22lbs Capacity (White, Set of 3, 16in)",$169.98 ,Furniture,4.5,45,"BAYKA Floating Shelves for Wall, Wall Mounted Rustic Wood Shelves for Bathroom, Bedroom, Living Room, Kitchen, Hanging Shelf for Books/Storage/Room Decor with 22lbs Capacity (White, Set of 3, 16in)"
"28. HomePop Mid-Century Accent Chair|Upholstered Armchair with Wood Armrest and Wood Legs|Accent Chairs for Living Room & Bedroom | Decorative Home Furniture, Light Gray Solid Woven",$61.98 ,Furniture,4.2,"3,220","HomePop Mid-Century Accent Chair|Upholstered Armchair with Wood Armrest and Wood Legs|Accent Chairs for Living Room & Bedroom | Decorative Home Furniture, Light Gray Solid Woven"
"29. Office Chair Big and Tall, High Back Home Office Chair 400 lbs, Executive Desk Chair, Ergonomic Office Chair with Padded Armrest, Swivel Computer Chair PU Leather (Brown)",$79.96 ,Furniture,4.5,24,"Office Chair Big and Tall, High Back Home Office Chair 400 lbs, Executive Desk Chair, Ergonomic Office Chair with Padded Armrest, Swivel Computer Chair PU Leather (Brown)"
"30. WLIVE Wide Fabric Dresser, 6 Drawer Dresser TV Stand for 60"" TV, Dressers Bedroom Furniture Large Storage Tower Unit with Fabric Bins, Black Dresser for Bedroom, Closet, Hallway, Black",$179.99 ,Furniture,4.7,212,"WLIVE Wide Fabric Dresser, 6 Drawer Dresser TV Stand for 60"" TV, Dressers Bedroom Furniture Large Storage Tower Unit with Fabric Bins, Black Dresser for Bedroom, Closet, Hallway, Black"
"1. INIU Wireless Charger, 15W Fast Qi-Certified Wireless Charging Station with Sleep-Friendly Adaptive Light Compatible with iPhone 16 15 14 13 Pro XS 8 Plus Samsung Galaxy S23 S22 S21 Note 20 Google etc",$12.98 ,Cellphone Accessories,4.3,"31,285","INIU Wireless Charger, 15W Fast Qi-Certified Wireless Charging Station with Sleep-Friendly Adaptive Light Compatible with iPhone 16 15 14 13 Pro XS 8 Plus Samsung Galaxy S23 S22 S21 Note 20 Google etc"
"2. LISEN Retractable Car Charger 4 in 1 [69W USB C Car Charger Adapter] iPhone 16 Car Charger Fast Charging, Gift for Men Women, Car Accessories USBC Car Charger for iPhone 16 15 14 13 12 Android, Gray",$17.99 ,Cellphone Accessories,4.6,"1,602","LISEN Retractable Car Charger 4 in 1 [69W USB C Car Charger Adapter] iPhone 16 Car Charger Fast Charging, Gift for Men Women, Car Accessories USBC Car Charger for iPhone 16 15 14 13 12 Android, Gray"
3. VANMASS „Äê65+LBS Strongest Suction & Military-Grade 2024 Ultimate Car Phone Mount„ÄêPatent & Safety Certs„Äë Cell Phone Holder Truck Stand for Dashboard Windshield Vent for iPhone 16 15 Pro Max 14 Samsung,$19.99 ,Cellphone Accessories,4.4,"53,776",VANMASS „Äê65+LBS Strongest Suction & Military-Grade 2024 Ultimate Car Phone Mount„ÄêPatent & Safety Certs„Äë Cell Phone Holder Truck Stand for Dashboard Windshield Vent for iPhone 16 15 Pro Max 14 Samsung
"4. MagSafe Phone Grip for iPhone - Magnetic Phone Ring Holder Detachable for iPhone 16 - Comfortable Finger Phone Ring Grip for Apple 15/14/13/12,Black",$26.99 ,Cellphone Accessories,4.4,56,"MagSafe Phone Grip for iPhone - Magnetic Phone Ring Holder Detachable for iPhone 16 - Comfortable Finger Phone Ring Grip for Apple 15/14/13/12,Black"
"5. SUPERONE for MagSafe Phone Grip, Adjustable Magnetic Phone Ring Holder Removable Finger Phone Ring Kickstand Compatible with MagSafe Accessories Only for iPhone 16 & 15 & 14 & 13 & 12 Series",$39.99 ,Cellphone Accessories,4.4,746,"SUPERONE for MagSafe Phone Grip, Adjustable Magnetic Phone Ring Holder Removable Finger Phone Ring Kickstand Compatible with MagSafe Accessories Only for iPhone 16 & 15 & 14 & 13 & 12 Series"
"6. Silicone Suction Cup Phone Case Mount Double Sided, Silicon Sticky Phone Grip with Higher Suction Power for Cell Phone, Hands-Free Phone Accessories Holder for Selfies and Videos, Transparent",$16.99 ,Cellphone Accessories,4.1,324,"Silicone Suction Cup Phone Case Mount Double Sided, Silicon Sticky Phone Grip with Higher Suction Power for Cell Phone, Hands-Free Phone Accessories Holder for Selfies and Videos, Transparent"
"7. 3 Pack of Butterfly Phone Ring Holder Set for iPhone,Cute Metal Butterfly Shaped Cellphone Grip for Girls/Women(Pink,Purple,Yellow)",$18.99 ,Cellphone Accessories,4.7,43,"3 Pack of Butterfly Phone Ring Holder Set for iPhone,Cute Metal Butterfly Shaped Cellphone Grip for Girls/Women(Pink,Purple,Yellow)"
"8. Miracase Phone Holders for Your Car with Metal Hook Clip, Air Vent Cell Phone Car Mount, Universal Automobile Cradle Fit for iPhone Android and All Smartphones, Dark Black",$9.99 ,Cellphone Accessories,4.3,"30,143","Miracase Phone Holders for Your Car with Metal Hook Clip, Air Vent Cell Phone Car Mount, Universal Automobile Cradle Fit for iPhone Android and All Smartphones, Dark Black"
"9. PopSockets Phone Grip Compatible with MagSafe, Adapter Ring for MagSafe Included, Phone Holder, Wireless Charging Compatible - Black",$6.99 ,Cellphone Accessories,4.6,"3,371","PopSockets Phone Grip Compatible with MagSafe, Adapter Ring for MagSafe Included, Phone Holder, Wireless Charging Compatible - Black"
"10. PopSockets Phone Grip with Expanding Kickstand, Black",$6.99 ,Cellphone Accessories,4.6,"56,959","PopSockets Phone Grip with Expanding Kickstand, Black"
"11. iOttie Easy One Touch 6 Universal Car Mount Dashboard & Windshield Suction Cup Phone Holder for iPhone Samsung, Google, All Smartphones",$9.99 ,Cellphone Accessories,4.4,"137,238","iOttie Easy One Touch 6 Universal Car Mount Dashboard & Windshield Suction Cup Phone Holder for iPhone Samsung, Google, All Smartphones"
12. iPhone Charger Fast Charging„ÄêMFi Certified„Äë 2Pack 20W PD USB C Wall Charger 6&10FT Cable Fasting Charging Adapter Compatible with iPhone 14Pro/13 Pro/12/12 Pro Max/11 Pro Max/XS Max/XS/XR/X/8 and More,$15.99 ,Cellphone Accessories,4.5,"3,314",iPhone Charger Fast Charging„ÄêMFi Certified„Äë 2Pack 20W PD USB C Wall Charger 6&10FT Cable Fasting Charging Adapter Compatible with iPhone 14Pro/13 Pro/12/12 Pro Max/11 Pro Max/XS Max/XS/XR/X/8 and More
"13. Nulaxy Dual Folding Cell Phone Stand, Fully Adjustable Foldable Desktop Phone Holder Cradle Dock Compatible with Phone 16 15 14 13 12 11 Pro Xs Xs Max Xr X 8, Nintendo Switch, All Phones",$29.56 ,Cellphone Accessories,4.7,"53,237","Nulaxy Dual Folding Cell Phone Stand, Fully Adjustable Foldable Desktop Phone Holder Cradle Dock Compatible with Phone 16 15 14 13 12 11 Pro Xs Xs Max Xr X 8, Nintendo Switch, All Phones"
14. Qifutan Car Phone Holder Mount Phone Mount for Car Windshield Dashboard Air Vent Universal Hands Free Automobile Cell Phone Holder Fit for iPhone Smartphone Carbon Fiber,$9.97 ,Cellphone Accessories,4.3,"18,072",Qifutan Car Phone Holder Mount Phone Mount for Car Windshield Dashboard Air Vent Universal Hands Free Automobile Cell Phone Holder Fit for iPhone Smartphone Carbon Fiber
"15. CACOE Phone Lanyard 2 Pack-2√ó Adjustable Neck Strap,2√ó Phone Patches,Universal Cell Phone Multifuctional Patch Lanyards Compatible with Most Smartphones(Black+Gray)",$17.95 ,Cellphone Accessories,4.3,"4,949","CACOE Phone Lanyard 2 Pack-2√ó Adjustable Neck Strap,2√ó Phone Patches,Universal Cell Phone Multifuctional Patch Lanyards Compatible with Most Smartphones(Black+Gray)"
"16. USB Type c Cable, 5 Pack (6FT) Nylon Braided 3A Fast Charging Cord for Samsung Galaxy S9 S8 Note 9 Note 8 Galaxy Note 20 10 S21 S20 S10 Plus",$26.95 ,Cellphone Accessories,4.6,"12,102","USB Type c Cable, 5 Pack (6FT) Nylon Braided 3A Fast Charging Cord for Samsung Galaxy S9 S8 Note 9 Note 8 Galaxy Note 20 10 S21 S20 S10 Plus"
"17. Lamicall Gooseneck Phone Holder for Bed - [Upgraded Stable Clip] for Desk, Headboard, Bed, Bedside, Table, Flexible Gooseneck Long Arm Stand, Overhead Cell Phone Clamp Mount, for All 4-7‚Äù Devices",$8.45 ,Cellphone Accessories,4.4,"23,770","Lamicall Gooseneck Phone Holder for Bed - [Upgraded Stable Clip] for Desk, Headboard, Bed, Bedside, Table, Flexible Gooseneck Long Arm Stand, Overhead Cell Phone Clamp Mount, for All 4-7‚Äù Devices"
"18. LISEN Cell Phone Stand Adjustable Phone Holer for Desk, Computer Office Desk Accessories for iPhone 16 Holder Women Kitchen Essentials Fits All Mobile Phones Switch Kindle iPads Tablet 4-10in",$4.23 ,Cellphone Accessories,4.5,"66,471","LISEN Cell Phone Stand Adjustable Phone Holer for Desk, Computer Office Desk Accessories for iPhone 16 Holder Women Kitchen Essentials Fits All Mobile Phones Switch Kindle iPads Tablet 4-10in"
"19. Miracase [Upgraded Version Cup Phone Holder for Car, Universal Adjustable Long Neck Car Phone Mount Cradle Friendly Compatible with iPhone Samsung Google and All 4.0-7.0 inches Smartphones",$15.99 ,Cellphone Accessories,4.5,"12,533","Miracase [Upgraded Version Cup Phone Holder for Car, Universal Adjustable Long Neck Car Phone Mount Cradle Friendly Compatible with iPhone Samsung Google and All 4.0-7.0 inches Smartphones"
"20. PopSockets Translucent Phone Grip with Expanding Kickstand, PopSockets for Phone, Translucent PopGrip - Clear Glitter Silver",$9.99 ,Cellphone Accessories,4.6,"49,917","PopSockets Translucent Phone Grip with Expanding Kickstand, PopSockets for Phone, Translucent PopGrip - Clear Glitter Silver"
"21. Christmas Tech Gift for Men, Cell Phone Stand with Wireless Bluetooth Speaker, Thanksgiving Present for Him Dad Who Wants Nothing, Desktop Cool Gadget Unique Idea Gift for Mom Wife Her",$14.99 ,Cellphone Accessories,4,66,"Christmas Tech Gift for Men, Cell Phone Stand with Wireless Bluetooth Speaker, Thanksgiving Present for Him Dad Who Wants Nothing, Desktop Cool Gadget Unique Idea Gift for Mom Wife Her"
22. iPhone Charger 3Pack 10FT Apple MFi Certified Lightning Cable Fast Charging iPhone Charger Cord Compatible with iPhone 14 13 12 11 Pro Max XR XS X 8 7 6 Plus SE and More - Colorful,$12.99 ,Cellphone Accessories,4.3,"3,452",iPhone Charger 3Pack 10FT Apple MFi Certified Lightning Cable Fast Charging iPhone Charger Cord Compatible with iPhone 14 13 12 11 Pro Max XR XS X 8 7 6 Plus SE and More - Colorful
"23. 3 in 1 Wireless Charging Station Foldable Wireless Charger, 15W Fast Magnetic Wireless Charger Stand for iPhone 15 14 13 12 Pro Max/Pro/Plus/Mini, iWatch Ultra/9/8/SE/7/6/5/4/3/2, Airpods Pro 3 2",$14.99 ,Cellphone Accessories,4.2,124,"3 in 1 Wireless Charging Station Foldable Wireless Charger, 15W Fast Magnetic Wireless Charger Stand for iPhone 15 14 13 12 Pro Max/Pro/Plus/Mini, iWatch Ultra/9/8/SE/7/6/5/4/3/2, Airpods Pro 3 2"
"24. 40W USB C Charger Block, 2-Pack 4-Port Type C Fast Charging Brick Dual PD&QC Wall Plug Adapter Compatible for iPhone 15/15 Pro/ 15 Pro Max/14/13/12, iPad, Airpods, iwatch, Samsung Galaxy",$9.99 ,Cellphone Accessories,4.6,"2,388","40W USB C Charger Block, 2-Pack 4-Port Type C Fast Charging Brick Dual PD&QC Wall Plug Adapter Compatible for iPhone 15/15 Pro/ 15 Pro Max/14/13/12, iPad, Airpods, iwatch, Samsung Galaxy"
25. Infinity Mobile Phone Chain Universal Case with Detachable Neckstrap - Compatible with Any Mobile Phone and Smartphone - Elegant Mobile Phone Lanyard Strap Made of Nylon & Silicone - Black,$13.99 ,Cellphone Accessories,4.1,"1,131",Infinity Mobile Phone Chain Universal Case with Detachable Neckstrap - Compatible with Any Mobile Phone and Smartphone - Elegant Mobile Phone Lanyard Strap Made of Nylon & Silicone - Black
"26. Kaptron Phone Tether Tab for iPhone - Heavy Duty Stainless Steel Metal Phone Tether Tabs, Phone Strap Replacement Part",$8.97 ,Cellphone Accessories,4.3,28,"Kaptron Phone Tether Tab for iPhone - Heavy Duty Stainless Steel Metal Phone Tether Tabs, Phone Strap Replacement Part"
27. Peak Design Mobile Everyday Loop Case Pixel 9 Pro - Sage,$59.95 ,Cellphone Accessories,5,1,Peak Design Mobile Everyday Loop Case Pixel 9 Pro - Sage
"28. LISEN for iPhone 16 MagSafe Car Mount, [Quick Install] Ultra Magnetic Long Arm Mag Safe Car Phone Holder Vent, Car Accessories Fit for iPhone 16 Pro Max 15 14 13 12 Plus Mini Men Women, Black",$12.78 ,Cellphone Accessories,4.4,"11,294","LISEN for iPhone 16 MagSafe Car Mount, [Quick Install] Ultra Magnetic Long Arm Mag Safe Car Phone Holder Vent, Car Accessories Fit for iPhone 16 Pro Max 15 14 13 12 Plus Mini Men Women, Black"
"29. 2024 Ultimate Car Phone Mount„Äê80+LBS Strongest Suction & Military-Grade„Äë„ÄêPatent & Safety Certs„Äë Cell Phone Holder Truck Stand for Dashboard Windshield Vent for iPhone 15 Pro Max 14 13 Samsung, Black",$15.99 ,Cellphone Accessories,4.4,"4,837","2024 Ultimate Car Phone Mount„Äê80+LBS Strongest Suction & Military-Grade„Äë„ÄêPatent & Safety Certs„Äë Cell Phone Holder Truck Stand for Dashboard Windshield Vent for iPhone 15 Pro Max 14 13 Samsung, Black"
30. [True Military-Grade] Car Phone Holder VANMASS [2024 Strongest Suction & Clip] Cell Phone Mount for Dashboard Windshield Vent Truck Accessories Cradle Dash Stand for iPhone 16 Pro Max 15 14 13 Android,$33.98 ,Cellphone Accessories,4.4,"13,197",[True Military-Grade] Car Phone Holder VANMASS [2024 Strongest Suction & Clip] Cell Phone Mount for Dashboard Windshield Vent Truck Accessories Cradle Dash Stand for iPhone 16 Pro Max 15 14 13 Android
"1. Push Up Board,Home Gym,Portable Exercise Equipment",$59.99 ,Sports,4.4,"1,027",Check each product page for other buying options. Price and other details may vary based on product size and color.
"2. Push Up Board,Home Gym,Portable Exercise Equipment,Pilates Bar & 20 Fitness Accessories with Resistance Bands & Ab Roller Wheel,Full Body Workout at Home",$89.99 ,Sports,4.6,89,"Push Up Board,Home Gym,Portable Exercise Equipment,Pilates Bar & 20 Fitness Accessories with Resistance Bands & Ab Roller Wheel,Full Body Workout at Home"
3. Tales from the Denver Broncos Sideline: A Collection of the Greatest Broncos Stories Ever Told,$26.99 ,Sports,4.4,98,Tales from the Denver Broncos Sideline: A Collection of the Greatest Broncos Stories Ever Told
4. Mini Basketball Hoop Indoor with 7 Colors LED Lights | Over The Door Basketball Hoop with Scorer and Batteries | Door Basketball Hoop for Room Toy Basketball Set for Boys Girls Teens Adults,$39.99 ,Sports,4.2,633,Mini Basketball Hoop Indoor with 7 Colors LED Lights | Over The Door Basketball Hoop with Scorer and Batteries | Door Basketball Hoop for Room Toy Basketball Set for Boys Girls Teens Adults
5. Mini Basketball Hoop Indoor with 7 Colors LED Lights | Over The Door Basketball Hoop with Scorer and Batteries | Door Basketball Hoop for Room Toy Basketball Set for Boys Girls Teens Adults,$29.99 ,Sports,4.7,560,Mini Basketball Hoop Indoor with 7 Colors LED Lights | Over The Door Basketball Hoop with Scorer and Batteries | Door Basketball Hoop for Room Toy Basketball Set for Boys Girls Teens Adults
"6. 3-in-1 Baseball Set for Kids 3-5 - Tee Ball Stand, Hanging Tee, Ball Launcher and 6 Softballs - Adjustable Height, Indoor/Outdoor Sport Gifts for Boys, Blue",$15.19 ,Sports,3.9,"2,393","3-in-1 Baseball Set for Kids 3-5 - Tee Ball Stand, Hanging Tee, Ball Launcher and 6 Softballs - Adjustable Height, Indoor/Outdoor Sport Gifts for Boys, Blue"
"7. Nerf Mini Foam Sports Ball Set - Foam Football, Soccer Ball + Basketball Set Soft Foam Sports Set for Kids",$19.99 ,Sports,4.2,14,"Nerf Mini Foam Sports Ball Set - Foam Football, Soccer Ball + Basketball Set Soft Foam Sports Set for Kids"
"8. Original with App, Used by Celebrities - MMA Gear Boxing Ball - Boxing Reflex Ball with Adjustable Strap - Interactive Boxball App Integration - 1 Pack",$29.99 ,Sports,4.8,"8,813","Original with App, Used by Celebrities - MMA Gear Boxing Ball - Boxing Reflex Ball with Adjustable Strap - Interactive Boxball App Integration - 1 Pack"
9. Hello Kitty Soccer Sports Athlete Tee Shirt T-Shirt,$19.99 ,Sports,4.4,"9,346",Hello Kitty Soccer Sports Athlete Tee Shirt T-Shirt
10. NERF Vortex Aero Howler Foam Football - NERF Soft Vortex Football for Long-Distance Throws - Perfect for Pool + Beach Football - Kids Aero Howler Whistle Vortex Foam Ball - Red,$9.89 ,Sports,4.6,448,NERF Vortex Aero Howler Foam Football - NERF Soft Vortex Football for Long-Distance Throws - Perfect for Pool + Beach Football - Kids Aero Howler Whistle Vortex Foam Ball - Red
"11. GoSports Slammo Game Set (Includes 3 Balls, Carrying Case and Rules) - Outdoor Lawn, Beach & Tailgating Roundnet Game for Kids, Teens & Adults",$11.99 ,Sports,4.4,61,"GoSports Slammo Game Set (Includes 3 Balls, Carrying Case and Rules) - Outdoor Lawn, Beach & Tailgating Roundnet Game for Kids, Teens & Adults"
12. Riddell 32 Piece NFL Helmet Tracker Set - Gumball Size Helmets - All NFL Current Logo's - New 2023 Set,$34.99 ,Sports,4.5,"19,045",Riddell 32 Piece NFL Helmet Tracker Set - Gumball Size Helmets - All NFL Current Logo's - New 2023 Set
13. Scholastic Year in Sports 2024,$34.90 ,Sports,4.5,"24,020",Scholastic Year in Sports 2024
"14. Sports Bras for Women,Padded Sports Bra Tank Top Sexy Crisscross Back High Impact Longline Workout Yoga Bra",$10.39 ,Sports,4.7,"28,005","Sports Bras for Women,Padded Sports Bra Tank Top Sexy Crisscross Back High Impact Longline Workout Yoga Bra"
"15. Sports Bras for Women,Padded Sports Bra Tank Top Sexy Crisscross Back High Impact Longline Workout Yoga Bra",$14.99 ,Sports,4.1,"1,949","Sports Bras for Women,Padded Sports Bra Tank Top Sexy Crisscross Back High Impact Longline Workout Yoga Bra"
"16. Under Armour Half Gallon Water Bottle Insulated, 64oz Insulated Water Bottle with Handle, Sports Water Jug, Fence Hook, Leak Resistant, for Baseball, Football & More",$9.99 ,Sports,4.5,291,"Under Armour Half Gallon Water Bottle Insulated, 64oz Insulated Water Bottle with Handle, Sports Water Jug, Fence Hook, Leak Resistant, for Baseball, Football & More"
"17. Skillmatics Card Game - Guess in 10 Sports, Stocking Stuffers, Perfect for Boys, Girls, Kids, and Families Who Love Toys, Board Games, Gifts for Ages 6, 7, 8, 9 and Up",$21.99 ,Sports,4.1,"1,385","Skillmatics Card Game - Guess in 10 Sports, Stocking Stuffers, Perfect for Boys, Girls, Kids, and Families Who Love Toys, Board Games, Gifts for Ages 6, 7, 8, 9 and Up"
"18. Hover Hockey Set for Kids, 3-in-1 Hover Hockey Soccer Ball Toy Set, Rechargeable Floating Air Soccer Hockey Ball with Led Light, Indoor Outdoor Sports Game Toy Gifts for 3 4 5 6 7 8+ 12 Years Boy Girl",$17.50 ,Sports,4.8,"33,660","Hover Hockey Set for Kids, 3-in-1 Hover Hockey Soccer Ball Toy Set, Rechargeable Floating Air Soccer Hockey Ball with Led Light, Indoor Outdoor Sports Game Toy Gifts for 3 4 5 6 7 8+ 12 Years Boy Girl"
"19. Sport - Indoor & Outdoor, No Boundaries - Similar to Pickleball, Badminton and Tennis with A Whole New Spin On It - Fun Games for Kids & Adults",$24.99 ,Sports,4.6,57,"Sport - Indoor & Outdoor, No Boundaries - Similar to Pickleball, Badminton and Tennis with A Whole New Spin On It - Fun Games for Kids & Adults"
20. Ceiling Swish: Indoor Mini Basketball Hoop for Kids Toy Game - Includes Basketball Net Backboard and Two Mini Basketballs,$14.95 ,Sports,4.1,60,Ceiling Swish: Indoor Mini Basketball Hoop for Kids Toy Game - Includes Basketball Net Backboard and Two Mini Basketballs
"21. adidas Alliance Sackpack (12L) Lightweight Athletic Small Drawstring Team Sports Workout Bag, Sandy Pink/White, One Size",$19.97 ,Sports,4.6,"16,939","adidas Alliance Sackpack (12L) Lightweight Athletic Small Drawstring Team Sports Workout Bag, Sandy Pink/White, One Size"
"22. WUC Garage Sports Equipment Organizer, Garage Ball Storage, Ball Storage Rack, Garage Organizer for Garage with Basket and Hooks, Rolling Sports Ball Storage Cart for Toy Sports Gear Storage, Black",$31.99 ,Sports,3.8,31,"WUC Garage Sports Equipment Organizer, Garage Ball Storage, Ball Storage Rack, Garage Organizer for Garage with Basket and Hooks, Rolling Sports Ball Storage Cart for Toy Sports Gear Storage, Black"
23. Check each product page for other buying options. Price and other details may vary based on product size and color.,$24.99 ,Sports,4.1,60,Check each product page for other buying options. Price and other details may vary based on product size and color.
24. GlowCity Premium Leather LED Rechargeable Light-Up Baseball - Illuminate The Game - Nighttime Fun and Play - Sports Stuff & Gadgets for Kids Age 8 Years Old and Up - Catch Only,$29.99 ,Sports,4.3,32,GlowCity Premium Leather LED Rechargeable Light-Up Baseball - Illuminate The Game - Nighttime Fun and Play - Sports Stuff & Gadgets for Kids Age 8 Years Old and Up - Catch Only
"25. VZV Kids Thermal Underwear Set, Boys Waffle Thermal Set Long Sleeve Base Layer Thermals Top and Bottom Set for Cold Weather",$12.99 ,Sports,4.4,85,"VZV Kids Thermal Underwear Set, Boys Waffle Thermal Set Long Sleeve Base Layer Thermals Top and Bottom Set for Cold Weather"
26. Got Your Answers: The 100 Greatest Sports Arguments Settled,$12.67 ,Sports,4.8,581,Got Your Answers: The 100 Greatest Sports Arguments Settled
27. GlowCity Premium Leather LED Rechargeable Light-Up Baseball - Illuminate The Game - Nighttime Fun and Play - Sports Stuff & Gadgets for Kids Age 8 Years Old and Up - Catch Only,$14.99 ,Sports,4.6,371,"Practice all night long! Our regulation-sized glow-in-the-dark soccer balls have a bright LED light that turns on upon impact. When youíre done playing, the LED powers off after 40 seconds of inactivity."
28. Got Your Answers: The 100 Greatest Sports Arguments Settled ,$9.99 ,Sports,4.7,857,Packers vs. Lions
29. Badminton and Tennis with A Whole New Spin On It - Fun Games for Kids & Adults,$14.99 ,Sports,4.6,238,Jazzminton Sport was originally created as an indoor game so don't hesitate to take it indoors especially when its cold or rainy out. The birdies slow as they fly making for exciting rallies that can really get those competitive juices flowing.
30. Weird But True Sports: 300 Wacky Facts About Awesome Athletics,$7.34 ,Sports,4.5,"6,160",Weird But True Sports: 300 Wacky Facts About Awesome Athletics
