"Links","Images","Title","Price","Rating"
"https://amazon.com/sspa/click?ie=UTF8&spc=MTo1OTA0NDkwMjAzNjk1Njg5OjE3MzE5MzE5NTU6c3BfYXRmX2Jyb3dzZTozMDAyOTQ4MjE0MDI5MDI6OjA6Og&url=%2FIndustrial-Horizontal-Bookshelf-Organizer-Bookcase%2Fdp%2FB0D6X4X5DD%2Fref%3Dsr_1_1_sspa%3Fqid%3D1731931954%26s%3Dkitchen-intl-ship%26sr%3D1-1-spons%26sp_csd%3Dd2lkZ2V0TmFtZT1zcF9hdGZfYnJvd3Nl%26psc%3D1","https://m.media-amazon.com/images/I/71ePkJk7qXL._AC_UL320_.jpg","Industrial Horizontal Bookshelf, Modern 6 Cube Storage Organizer Open Shelf, Low Wide Cubby Bookcase for Home Office Living, Wooden Metal Short Book Shelf Bedroom Storage,Dining Room Shelves (Oak)","187.","4.5 out of 5 stars"
"https://amazon.com/sspa/click?ie=UTF8&spc=MTo1OTA0NDkwMjAzNjk1Njg5OjE3MzE5MzE5NTU6c3BfYXRmX2Jyb3dzZTozMDA1MDU3Mzk1MDc2MDI6OjA6Og&url=%2FHuuger-Drawers-Charging-Nightstand-Entryway%2Fdp%2FB0CJM6ZQ41%2Fref%3Dsr_1_2_sspa%3Fqid%3D1731931954%26s%3Dkitchen-intl-ship%26sr%3D1-2-spons%26sp_csd%3Dd2lkZ2V0TmFtZT1zcF9hdGZfYnJvd3Nl%26psc%3D1","https://m.media-amazon.com/images/I/81O+gmItf2L._AC_UL320_.jpg","Huuger 5 Drawers Dresser with Charging Station, Dresser for Bedroom, Tall Night Stand, Chest of Drawers with PU Leather Finish, Open Shelf, Bedside Table Nightstand, for Entryway, White","59.","4.5 out of 5 stars"
"https://amazon.com/sspa/click?ie=UTF8&spc=MTo1OTA0NDkwMjAzNjk1Njg5OjE3MzE5MzE5NTU6c3BfYXRmX2Jyb3dzZTozMDA1MjcxNjc2MTU5MDI6OjA6Og&url=%2FVASAGLE-Bookshelf-Bookcase-Adjustable-ULBC163T56%2Fdp%2FB0CMD6YMPD%2Fref%3Dsr_1_3_sspa%3Fqid%3D1731931954%26s%3Dkitchen-intl-ship%26sr%3D1-3-spons%26sp_csd%3Dd2lkZ2V0TmFtZT1zcF9hdGZfYnJvd3Nl%26psc%3D1","https://m.media-amazon.com/images/I/91NQ6PQMIXL._AC_UL320_.jpg","VASAGLE Bookshelf, 23.6 Inches Wide, 3-Tier Open Bookcase with Adjustable Storage Shelves, Floor Standing Unit, Ebony Black ULBC163T56","49.","4.3 out of 5 stars"
"https://amazon.com/sspa/click?ie=UTF8&spc=MTo1OTA0NDkwMjAzNjk1Njg5OjE3MzE5MzE5NTU6c3BfbXRmX2Jyb3dzZTozMDA1NDUwODY1MzMxMDI6OjA6Og&url=%2FAdjustable-Starlink-Gen-Mount-Mounting%2Fdp%2FB0DHKSL3PD%2Fref%3Dsr_1_4_sspa%3Fqid%3D1731931954%26s%3Dkitchen-intl-ship%26sr%3D1-4-spons%26sp_csd%3Dd2lkZ2V0TmFtZT1zcF9tdGZfYnJvd3Nl%26psc%3D1","https://m.media-amazon.com/images/I/61DuvpaT5kL._AC_UL320_.jpg","Adjustable Starlink Gen 3 Mount, Starlink Wall Mount Gen 3, Roof Mount for Starlink, V3 Pole Mount, Starlink Mount Gen 3, Starlink Mounting Kit Gen 3","58.","5.0 out of 5 stars"
"https://amazon.com/sspa/click?ie=UTF8&spc=MTo1OTA0NDkwMjAzNjk1Njg5OjE3MzE5MzE5NTU6c3BfbXRmX2Jyb3dzZTozMDA1MjA2NjQwNzk2MDI6OjA6Og&url=%2FDomiqut-Creativing-Furniture-Toddlers%25EF%25BC%258C-Convertible%2Fdp%2FB0D2VWCJVB%2Fref%3Dsr_1_5_sspa%3Fqid%3D1731931954%26s%3Dkitchen-intl-ship%26sr%3D1-5-spons%26sp_csd%3Dd2lkZ2V0TmFtZT1zcF9tdGZfYnJvd3Nl%26psc%3D1","https://m.media-amazon.com/images/I/71RH6j-BjKL._AC_UL320_.jpg","22Pcs Modular Kids Play Couch, Floor Sofa for Children, 1000+DIY Creativing Playroom Furniture for Toddlers， Convertible Foam and Floor Cushion for Boys and Girls","199.","4.3 out of 5 stars"
"https://amazon.com/sspa/click?ie=UTF8&spc=MTo1OTA0NDkwMjAzNjk1Njg5OjE3MzE5MzE5NTU6c3BfbXRmX2Jyb3dzZTozMDAyNzIxMjkwMjc1MDI6OjA6Og&url=%2FCommercial-Grade-Door-Floor-Mat%2Fdp%2FB0D3HP1P5L%2Fref%3Dsr_1_6_sspa%3Fqid%3D1731931954%26s%3Dkitchen-intl-ship%26sr%3D1-6-spons%26sp_csd%3Dd2lkZ2V0TmFtZT1zcF9tdGZfYnJvd3Nl%26psc%3D1","https://m.media-amazon.com/images/I/81GH3H2+ulL._AC_UL320_.jpg","Commercial Grade Door Floor Mat - 3' x 10' Brush Step Entrance Mat - Vinyl Backed Utility Doormat - Heavy Duty Floor Mat for Commercial Outdoor and Indoor Entrances","89.","4.7 out of 5 stars"
"https://amazon.com/sspa/click?ie=UTF8&spc=MTo1OTA0NDkwMjAzNjk1Njg5OjE3MzE5MzE5NTU6c3BfYnRmX2Jyb3dzZTozMDA1MjgzMTc2MjI3MDI6OjA6Og&url=%2FChooChoo-Farmhouse-Bathroom-Adjustable-Space-Saving%2Fdp%2FB0DBDD4JGS%2Fref%3Dsr_1_7_sspa%3Fqid%3D1731931954%26s%3Dkitchen-intl-ship%26sr%3D1-7-spons%26sp_csd%3Dd2lkZ2V0TmFtZT1zcF9idGZfYnJvd3Nl%26psc%3D1","https://m.media-amazon.com/images/I/819VJVDmn8L._AC_UL320_.jpg","ChooChoo Over The Toilet Storage Cabinet, Farmhouse Bathroom Storage Cabinet with Barn Doors, Sliding Drawer, Adjustable Shelves, Space-Saving, White","129.",""
"https://amazon.com/sspa/click?ie=UTF8&spc=MTo1OTA0NDkwMjAzNjk1Njg5OjE3MzE5MzE5NTU6c3BfYnRmX2Jyb3dzZTozMDA0NjgwMTA0MzgwMDI6OjA6Og&url=%2FVeken-47-2x27-6-Adjustable-Ergonomic-Workstation%2Fdp%2FB0D795M5GT%2Fref%3Dsr_1_8_sspa%3Fqid%3D1731931954%26s%3Dkitchen-intl-ship%26sr%3D1-8-spons%26sp_csd%3Dd2lkZ2V0TmFtZT1zcF9idGZfYnJvd3Nl%26psc%3D1","https://m.media-amazon.com/images/I/71lu-y-GtwL._AC_UL320_.jpg","Veken Wider 47.2x27.6 Inch Whole Piece 1-Inch Thick Standing Desk with Side Storage Pocket, Electric Adjustable Height Rising Table, Ergonomic Office Computer Desks for Workstation,Study,Gaming,Brown","209.","5.0 out of 5 stars"
"https://amazon.com/sspa/click?ie=UTF8&spc=MTo1OTA0NDkwMjAzNjk1Njg5OjE3MzE5MzE5NTU6c3BfYnRmX2Jyb3dzZTozMDA1MjI3NzA1MjMzMDI6OjA6Og&url=%2FStorage-Entryway-Cabinet-Organizer-Entrance%2Fdp%2FB0DHTQK8VY%2Fref%3Dsr_1_9_sspa%3Fqid%3D1731931954%26s%3Dkitchen-intl-ship%26sr%3D1-9-spons%26sp_csd%3Dd2lkZ2V0TmFtZT1zcF9idGZfYnJvd3Nl%26psc%3D1","https://m.media-amazon.com/images/I/81DjLsHpBXL._AC_UL320_.jpg","Rattan Shoe Storage Bench Entryway Bench with Storage, Shoe Bench Shoe Cabinet Storage for Entryway, Shoe Rack Bench Shoe Organizer Cabinet with Cushion for Entrance, Hallway, Living Room, Bedroom","129.","3.6 out of 5 stars"
